{"$schema":"./challenger-replacement-opportunity-result-evidence-v2.schema.json","accounting":{"fee":"0","fill_price":null,"funding_cashflow":"0","notional":"0","quantity":"0","realized_pnl":"0"},"authority":{"account_requests":0,"broker_requests":0,"credentials_used":false,"network_requests":0,"orders_submitted_to_venue":0,"production_activation":false,"production_state_writes":0,"real_orders_allowed":false,"replacement_start_authorized":false,"runtime_install_authorized":false},"build_identity":{"build_input_tree_hash":"7777777777777777777777777777777777777777777777777777777777777777","manifest_file_sha256":"9999999999999999999999999999999999999999999999999999999999999999","manifest_hash":"8888888888888888888888888888888888888888888888888888888888888888","manifest_version":"1.66.0","package_version":"0.72.0","peeled_commit":"9999999999999999999999999999999999999999","release_tag":"v0.72.0-fixture"},"decision":{"action":"HOLD_PERP_SHORT","daily_loss":"0.137874","decision_hash":"de50ec7735e43a88549fc14f2926e8b4bd86602c839c2f70c01fa0179dbfdabc","decision_id":"challenger_replacement_simulation_decision_21ac36631849d0f3933d539093a300811148f403f3e871e4bb378239333c86e2","drawdown":"0.137874","indicators":{"lag5_close":"2000","latest_close":"1980","long_signal":false,"prior_sma20":"2000","short_signal":true},"opportunity_id":"ETHUSDT@2026-08-25T04:00:00.000Z","plan":{"plan_hash":"f29474a1700b0c3cf313047e2d6e85182e68104d9584ec9df7b492aa7ab00486","plan_id":"challenger_replacement_plan_v3_e1b6a4187cb4bb4b371ea503f83284056d4f0c6c504feb7827971869a52f666f"},"policy_bindings":{"decision_policy_hash":"1a201f174e45f1f990efd5d4198fa1be3b00de0115fa1ff73d2aef046456ad32","risk_policy_hash":"f7d42570ef7772914d6c9753a7402f62aa8b2d7583693521ae5faf643d9a2fab"},"position_before":"PERP_SHORT","previous_snapshot_hash":"dd13ca3ee0f29c26ef7cf06f1a8c6b203db47ec0ff1b4fd6cbdeb274aced5c91","reason_code":"MINIMUM_HOLD_ACTIVE","risk_approval":"RISK_APPROVED","source_hash":"a16f95b7b67fa8970a0a3f710ba38e41a05ead82cc884d3e5728273fc5c1745a"},"evidence_qualification":"COMMITTED_FIXTURE_NOT_LIVE_MARKET_OR_ACCOUNT","lifecycle":{"events":[{"attempt_id_or_null":null,"event_hash":"a1ad121652189467ac7be383d70053e30710e1553c52d886c8c58a77d29cc8a1","event_type":"NO_INTENT_RECONCILED","intent_id_or_null":null,"ordinal":1,"parent_event_hash_or_null":null,"payload":{"action":"HOLD_PERP_SHORT","reason_code":"MINIMUM_HOLD_ACTIVE"}},{"attempt_id_or_null":null,"event_hash":"52203bd1d33c5f85339d9022ff039d9d6b3a5f0fce4302da0e61385030a1e3e2","event_type":"LIFECYCLE_RECONCILED_FIXTURE","intent_id_or_null":null,"ordinal":2,"parent_event_hash_or_null":"a1ad121652189467ac7be383d70053e30710e1553c52d886c8c58a77d29cc8a1","payload":{"engine_projection_hash":"a8832365ef161bcab39e2c8f24588619d2831b1ac962b9b14e690aad1ef6862a","ledger_projection_hash":"a8832365ef161bcab39e2c8f24588619d2831b1ac962b9b14e690aad1ef6862a","venue_projection_hash":"a8832365ef161bcab39e2c8f24588619d2831b1ac962b9b14e690aad1ef6862a"}}],"operationally_complete":true,"reason_code_or_null":null,"status":"RECONCILED_FIXTURE"},"mode":"FIXTURE_SIMULATION_NO_NETWORK_NO_ACCOUNT_NO_BROKER_NO_REAL_ORDER","next_snapshot":{"active_order_or_null":null,"cash":"99.928126","contract_multiplier":"1","cumulative_fees":"0.071874","cumulative_funding":"0","day_start_date_or_null":"2026-08-25","day_start_equity":"100","economic_gap_locked":false,"entry_price_or_null":"1996.5","entry_time":"2026-08-25T00:00:00.000Z","gross_exposure":"0.48048246038743457154116666813202034172595123800989","instrument_metadata_hash_or_null":"9c70468e1f7657e053e6c7134d17b5c9bedd897c38e62ffb4cb14ca57ec59328","isolated_margin":"47.916","marked_equity":"99.862126","opportunity_id_or_null":"ETHUSDT@2026-08-25T04:00:00.000Z","parent_snapshot_hash_or_null":"dd13ca3ee0f29c26ef7cf06f1a8c6b203db47ec0ff1b4fd6cbdeb274aced5c91","peak_equity":"100","position_certainty":"VERIFIED","position_state":"PERP_SHORT","protective_stop_or_null":{"product":"perpetual","quantity":"0.024","reduce_only":true,"side":"BUY","status":"CONFIRMED_FIXTURE","stop_attempt_id":"replacement_attempt_f38c6f78af26632c27b2d90312f32499ba6c7d3b1a48de74c7c895cc53c5eb85","stop_client_order_id":"replacement_client_0136a5c6d19d0648489da61735c3a91ee4e5ee42eb5ea296fbdbb7fbcd90c4f7","stop_intent_id":"replacement_stop_a987db30f20048144fbc10f891eebc42fb6dd6f93c2d818c55ae5fa22d7434fb","trigger_price":"2036.43"},"realized_pnl":"0","reverse_blocked_until_next_opportunity":false,"risk_state":"RISK_CLEAR","signed_quantity":"-0.024","snapshot_hash":"c2036c892692c761cf69fb44f7d9d38a11ec6e7b15089817c2ae43bddd509226","snapshot_version":"1.0.0","unrealized_pnl":"-0.066","unresolved_intent_ids":[]},"opportunity":{"capture_close":"2026-08-25T04:10:00.000Z","capture_open":"2026-08-25T04:02:00.000Z","observed_at":"2026-08-25T04:05:00.000Z","opportunity_id":"ETHUSDT@2026-08-25T04:00:00.000Z","scheduled_for":"2026-08-25T04:00:00.000Z"},"plan":{"plan_hash":"f29474a1700b0c3cf313047e2d6e85182e68104d9584ec9df7b492aa7ab00486","plan_id":"challenger_replacement_plan_v3_e1b6a4187cb4bb4b371ea503f83284056d4f0c6c504feb7827971869a52f666f"},"previous_snapshot":{"active_order_or_null":null,"cash":"99.928126","contract_multiplier":"1","cumulative_fees":"0.071874","cumulative_funding":"0","day_start_date_or_null":"2026-08-25","day_start_equity":"100","economic_gap_locked":false,"entry_price_or_null":"1996.5","entry_time":"2026-08-25T00:00:00.000Z","gross_exposure":"0.48048246038743457154116666813202034172595123800989","instrument_metadata_hash_or_null":"9c70468e1f7657e053e6c7134d17b5c9bedd897c38e62ffb4cb14ca57ec59328","isolated_margin":"47.916","marked_equity":"99.862126","opportunity_id_or_null":"ETHUSDT@2026-08-25T00:00:00.000Z","parent_snapshot_hash_or_null":"35dd2b5c6ef49c0fce05a6c82f8a0f03294f63a34468818b48320dd19c562613","peak_equity":"100","position_certainty":"VERIFIED","position_state":"PERP_SHORT","protective_stop_or_null":{"product":"perpetual","quantity":"0.024","reduce_only":true,"side":"BUY","status":"CONFIRMED_FIXTURE","stop_attempt_id":"replacement_attempt_f38c6f78af26632c27b2d90312f32499ba6c7d3b1a48de74c7c895cc53c5eb85","stop_client_order_id":"replacement_client_0136a5c6d19d0648489da61735c3a91ee4e5ee42eb5ea296fbdbb7fbcd90c4f7","stop_intent_id":"replacement_stop_a987db30f20048144fbc10f891eebc42fb6dd6f93c2d818c55ae5fa22d7434fb","trigger_price":"2036.43"},"realized_pnl":"0","reverse_blocked_until_next_opportunity":false,"risk_state":"RISK_CLEAR","signed_quantity":"-0.024","snapshot_hash":"dd13ca3ee0f29c26ef7cf06f1a8c6b203db47ec0ff1b4fd6cbdeb274aced5c91","snapshot_version":"1.0.0","unrealized_pnl":"-0.066","unresolved_intent_ids":[]},"result_hash":"6b73c2522c0f8caaed78af9d0a1962e935a1abab601f5adcbefabbe6e4fcf8e4","result_id":"challenger_replacement_simulation_result_6d442f099db5c472409ca2403bb1242752e92ba44ef44cea3078637e7c8cc20e","risk":{"approval":"RISK_APPROVED","reason_code":"MINIMUM_HOLD_ACTIVE"},"schema_version":"2.0.0","simulation_contract":{"contract_hash":"b21beb877101590aabcc65927539d58eb001c4dc5de89ead0306ac840450f501","contract_id":"challenger_replacement_simulation_contract_c95cee71f23e58cf40bc4739e5063824de1a77fd5c6fcc72794ff42e1f84f791"},"source":{"input_hash":"a16f95b7b67fa8970a0a3f710ba38e41a05ead82cc884d3e5728273fc5c1745a","input_id":"challenger_replacement_binance_simulation_input_2548c41f80b002c91516586beec79a145d3e44de508ea2c52709549aedf1ec29"}}