{"$schema":"./challenger-replacement-opportunity-result-evidence-v2.schema.json","accounting":{"fee":"0","fill_price":null,"funding_cashflow":"0","notional":"0","quantity":"0","realized_pnl":"0"},"authority":{"account_requests":0,"broker_requests":0,"credentials_used":false,"network_requests":0,"orders_submitted_to_venue":0,"production_activation":false,"production_state_writes":0,"real_orders_allowed":false,"replacement_start_authorized":false,"runtime_install_authorized":false},"build_identity":{"build_input_tree_hash":"7777777777777777777777777777777777777777777777777777777777777777","manifest_file_sha256":"9999999999999999999999999999999999999999999999999999999999999999","manifest_hash":"8888888888888888888888888888888888888888888888888888888888888888","manifest_version":"1.66.0","package_version":"0.72.0","peeled_commit":"9999999999999999999999999999999999999999","release_tag":"v0.72.0-fixture"},"decision":{"action":"HOLD_SPOT_LONG","daily_loss":"0.17466143","decision_hash":"647a12587be174632e6a85aa4cbc0b8102b72e9cea7cbe19200388bbdd698ebe","decision_id":"challenger_replacement_simulation_decision_66962cef3ceb7eac5f00fcbde4422f294c60e12246ae50ba050ef064cd18696d","drawdown":"0.17466143","indicators":{"lag5_close":"2000","latest_close":"2020","long_signal":true,"prior_sma20":"2000","short_signal":false},"opportunity_id":"ETHUSDT@2026-08-24T04:00:00.000Z","plan":{"plan_hash":"f29474a1700b0c3cf313047e2d6e85182e68104d9584ec9df7b492aa7ab00486","plan_id":"challenger_replacement_plan_v3_e1b6a4187cb4bb4b371ea503f83284056d4f0c6c504feb7827971869a52f666f"},"policy_bindings":{"decision_policy_hash":"1a201f174e45f1f990efd5d4198fa1be3b00de0115fa1ff73d2aef046456ad32","risk_policy_hash":"f7d42570ef7772914d6c9753a7402f62aa8b2d7583693521ae5faf643d9a2fab"},"position_before":"SPOT_LONG","previous_snapshot_hash":"9f8cc19d1c4ed802fd5a04b0f4ac3b96259eefd13e793c0e14df8cd83c68421d","reason_code":"MINIMUM_HOLD_ACTIVE","risk_approval":"RISK_APPROVED","source_hash":"9d606c2b72cdf898644a15048c69d376b5d05c26dcc8fc0c6f13c10c1237335f"},"evidence_qualification":"COMMITTED_FIXTURE_NOT_LIVE_MARKET_OR_ACCOUNT","lifecycle":{"events":[{"attempt_id_or_null":null,"event_hash":"be09232f4d3b294e9983de84b6e278de1dd3d8c3678147359237bb6a294cf9c6","event_type":"NO_INTENT_RECONCILED","intent_id_or_null":null,"ordinal":1,"parent_event_hash_or_null":null,"payload":{"action":"HOLD_SPOT_LONG","reason_code":"MINIMUM_HOLD_ACTIVE"}},{"attempt_id_or_null":null,"event_hash":"bc23c4e70fac9885c9a0e62d347db58332e4f32b436fbdc71cfc19b2987125a4","event_type":"LIFECYCLE_RECONCILED_FIXTURE","intent_id_or_null":null,"ordinal":2,"parent_event_hash_or_null":"be09232f4d3b294e9983de84b6e278de1dd3d8c3678147359237bb6a294cf9c6","payload":{"engine_projection_hash":"4132c60ee60efce76f6b26353c7d9e41e1ea27b6d261faf46f9a837c538fbe25","ledger_projection_hash":"4132c60ee60efce76f6b26353c7d9e41e1ea27b6d261faf46f9a837c538fbe25","venue_projection_hash":"4132c60ee60efce76f6b26353c7d9e41e1ea27b6d261faf46f9a837c538fbe25"}}],"operationally_complete":true,"reason_code_or_null":null,"status":"RECONCILED_FIXTURE"},"mode":"FIXTURE_SIMULATION_NO_NETWORK_NO_ACCOUNT_NO_BROKER_NO_REAL_ORDER","next_snapshot":{"active_order_or_null":null,"cash":"50.05023857","contract_multiplier":"1","cumulative_fees":"0.07481243","cumulative_funding":"0","day_start_date_or_null":"2026-08-24","day_start_equity":"100","economic_gap_locked":false,"entry_price_or_null":"2003.01","entry_time":"2026-08-24T00:00:00.000Z","gross_exposure":"0.49862190014107958161468622805593555824591079070357","instrument_metadata_hash_or_null":"836a5f35e48d0e98ea1442694f839e9e7fe8ac5b83ced64dee0e61946e075876","isolated_margin":"0","marked_equity":"99.82533857","opportunity_id_or_null":"ETHUSDT@2026-08-24T04:00:00.000Z","parent_snapshot_hash_or_null":"9f8cc19d1c4ed802fd5a04b0f4ac3b96259eefd13e793c0e14df8cd83c68421d","peak_equity":"100","position_certainty":"VERIFIED","position_state":"SPOT_LONG","protective_stop_or_null":{"product":"spot","quantity":"0.0249","reduce_only":false,"side":"SELL","status":"CONFIRMED_FIXTURE","stop_attempt_id":"replacement_attempt_7a300ae6ae286696aa6e5e4ae8b28bd812368848e2125bea2405b09c9d60e67f","stop_client_order_id":"replacement_client_77f465eea88d79b00e7331d086677317189ec9ca46ff4fdcd08ff15481b3e465","stop_intent_id":"replacement_stop_560d49eb0fbbcafb37627d4d3f54d03cc487b133d1aebb070f4f033764043c6c","trigger_price":"1962.94"},"realized_pnl":"0","reverse_blocked_until_next_opportunity":false,"risk_state":"RISK_CLEAR","signed_quantity":"0.0249","snapshot_hash":"7839130d742b5f9fd22d1f8363a512f4165e3a4731db49b84cf104c67c23732a","snapshot_version":"1.0.0","unrealized_pnl":"-0.099849","unresolved_intent_ids":[]},"opportunity":{"capture_close":"2026-08-24T04:10:00.000Z","capture_open":"2026-08-24T04:02:00.000Z","observed_at":"2026-08-24T04:05:00.000Z","opportunity_id":"ETHUSDT@2026-08-24T04:00:00.000Z","scheduled_for":"2026-08-24T04:00:00.000Z"},"plan":{"plan_hash":"f29474a1700b0c3cf313047e2d6e85182e68104d9584ec9df7b492aa7ab00486","plan_id":"challenger_replacement_plan_v3_e1b6a4187cb4bb4b371ea503f83284056d4f0c6c504feb7827971869a52f666f"},"previous_snapshot":{"active_order_or_null":null,"cash":"50.05023857","contract_multiplier":"1","cumulative_fees":"0.07481243","cumulative_funding":"0","day_start_date_or_null":"2026-08-24","day_start_equity":"100","economic_gap_locked":false,"entry_price_or_null":"2003.01","entry_time":"2026-08-24T00:00:00.000Z","gross_exposure":"0.49862190014107958161468622805593555824591079070357","instrument_metadata_hash_or_null":"836a5f35e48d0e98ea1442694f839e9e7fe8ac5b83ced64dee0e61946e075876","isolated_margin":"0","marked_equity":"99.82533857","opportunity_id_or_null":"ETHUSDT@2026-08-24T00:00:00.000Z","parent_snapshot_hash_or_null":"35dd2b5c6ef49c0fce05a6c82f8a0f03294f63a34468818b48320dd19c562613","peak_equity":"100","position_certainty":"VERIFIED","position_state":"SPOT_LONG","protective_stop_or_null":{"product":"spot","quantity":"0.0249","reduce_only":false,"side":"SELL","status":"CONFIRMED_FIXTURE","stop_attempt_id":"replacement_attempt_7a300ae6ae286696aa6e5e4ae8b28bd812368848e2125bea2405b09c9d60e67f","stop_client_order_id":"replacement_client_77f465eea88d79b00e7331d086677317189ec9ca46ff4fdcd08ff15481b3e465","stop_intent_id":"replacement_stop_560d49eb0fbbcafb37627d4d3f54d03cc487b133d1aebb070f4f033764043c6c","trigger_price":"1962.94"},"realized_pnl":"0","reverse_blocked_until_next_opportunity":false,"risk_state":"RISK_CLEAR","signed_quantity":"0.0249","snapshot_hash":"9f8cc19d1c4ed802fd5a04b0f4ac3b96259eefd13e793c0e14df8cd83c68421d","snapshot_version":"1.0.0","unrealized_pnl":"-0.099849","unresolved_intent_ids":[]},"result_hash":"32b434e0d374358c51258c6c5ab49c24105a65454c3d8aeebc89bacd8701d24b","result_id":"challenger_replacement_simulation_result_4c5b1068ba00905c66189b3aeb7ed22ed9fc45e35835b46e161445a34448f27a","risk":{"approval":"RISK_APPROVED","reason_code":"MINIMUM_HOLD_ACTIVE"},"schema_version":"2.0.0","simulation_contract":{"contract_hash":"b21beb877101590aabcc65927539d58eb001c4dc5de89ead0306ac840450f501","contract_id":"challenger_replacement_simulation_contract_c95cee71f23e58cf40bc4739e5063824de1a77fd5c6fcc72794ff42e1f84f791"},"source":{"input_hash":"9d606c2b72cdf898644a15048c69d376b5d05c26dcc8fc0c6f13c10c1237335f","input_id":"challenger_replacement_binance_simulation_input_31277000f1180b0788378e0da83e5d48f908b36789a4f89cc1258bbf4627d062"}}